date,area,item,status,refs,key_paths,summary
2026-07-02,ethics/honesty,Custody auto-log default flipped ON per the Item-N ruling,shipped (backend verified py3.13),claude/version-upgrade-plan-umv9xd,src/custody/settings.py src/config/settings.py tests/test_custody_settings.py,"The UI (index.html Settings->Safety) told the user auto-logging on ingest is on by default while the code default was False — an honesty-by-construction violation. Flipped the default to True per the 2026-06-15 Item-N ruling (local log write only, no egress verified); opt-out preserved; tests updated."
2026-07-02,ethics/honesty,Field-test mode flipped to OPT-IN for the public tag,shipped (backend verified py3.13),claude/version-upgrade-plan-umv9xd,src/monitoring/field_test.py docs/USER_MANUAL.md,The self-declared TEMPORARY instrumentation (auto-exercising fetch surfaces in every collect pass + unbounded data/field_test.jsonl) shipped default-ON. A public 0.1 must not auto-instrument: now OO_FIELD_TEST=1 enables; module kept for live-test cycles; manual + ledger wording aligned.
2026-07-02,docs/reciprocity,Two-direction docs<->app + ethics-coherence sweep applied,shipped,claude/version-upgrade-plan-umv9xd,docs/USER_MANUAL.md README.md docs/QUICKSTART.md docs/ETHICS.md docs/SECURITY.md docs/CHANGES.md docs/product/USE_CASES.md,A 128-defect verified inventory (doc-claims-app-lacks / app-has-doc-lacks / stale-reference / ethics-claim-unenforced) applied: USER_MANUAL rewritten to the shipped analysis window + ooMap + unified backup + real nav/Settings anatomy; README/QUICKSTART install + feature truth-up both directions; ETHICS rate-limit/UA/encryption claims corrected + bundled-artifact attribution table; SECURITY at-rest + airplane-guard sections + honest external-call enumeration; CHANGES 0.09 backfilled 06-18->07-01 + same-cycle contradictions annotated. Every claim re-verified against code before writing.
2026-07-02,ui/honesty,Frontend honesty + data-safety + consent-surface i18n batch,shipped (node+i18n verified; browser campaign green),claude/version-upgrade-plan-umv9xd,src/static/app.js src/static/index.html src/static/locales/*.json,Back-up-first rerouted off the 2GiB-capped path to the unified Export dialog; DB-IP CC BY 4.0 attribution rendered on the Server-IPs map layer; airplane going-offline toast made true-at-time-of-claim; unified Export/Import dialog keyed x12 (consent surface); 10 smaller stale/overclaim copy fixes. i18n gate 1711/1711 x12.
2026-07-02,qa/browser,First in-container Playwright click-through of the fork-3 debt,shipped (campaign reports in session artifacts),claude/version-upgrade-plan-umv9xd,tests/test_packaging_data_files.py,"The app boots in-container (py3.13 venv, encrypted store, 3395 sources auto-seeded, zero network) and was driven by real Chromium: first-run wizard, every sidebar tab, all 13 Settings + 8 Insights + 12 analysis subtabs, agenda views, /tasks, language fr round-trip, palette — ZERO console errors, ZERO HTTP>=400 across ~100 interactions. EMPIRICAL LESSON: the first-run guided-wizard modal blocks all clicks until completed (by design) — any UI automation must complete/dismiss it first (#gw-stay-offline + #net-coach-dismiss)."
2026-07-02,sources/diversification,Source-diversification brief (fabrication-proof external-session prompt),shipped,#523,docs/design/SOURCE_DIVERSIFICATION_BRIEF.md,"reusable orchestrator+worker brief for an internet-connected session: PART 0 capability preflight (no subagents/no live web -> STOP with ZERO entries), 14 language/region clusters, per-source verification protocol (HTTP 200 -> feed parse -> >=3 entries -> liveness <=120d -> robots), exact sources.yml schema; refuse-over-hallucinate by construction."
2026-07-02,sources/diversification,+224 live-verified sources imported (catalog 3205->3429),shipped,#533 #537,configs/sources.yml docs/ledger/source_diversification_2026-07.report.md,"the external verified run's output imported additively (dedup on registrable_domain, canonical source_type vocab validated); the verbatim provenance report with per-cluster rejection logs committed to the ledger (#537). Root-cause fix for the 79%-English corpus (catalog was 73% English sources)."
2026-07-02,scheduler/coverage,Per-tag scraping coverage status (tag_coverage),shipped (backend verified py3.11),#534,src/scheduler/coverage.py tests/test_tag_coverage.py,"per-tag reach/fresh/never_reached/backed_off/status-mix/oldest-age from FeedFetchState; multi-tag sources counted per tag; crawl sources counted-not-tracked honestly; untagged bucket; least-reached-first ordering; method+caveat strings; counts only NO score. Answers ""which tags have been scraped, how many remain, at what percentage""."
2026-07-02,scheduler/equilibrium,Opt-in per-language cadence lever (default OFF),shipped (backend verified py3.11),#537,src/scheduler/equilibrium.py src/scheduler/settings.py src/scheduler/runner.py src/api/scheduler.py tests/test_language_equilibrium.py,language_equilibrium target shares (empty dict = OFF = zero behaviour change): probabilistic per-pass defer of over-target languages via language_pace floored at equilibrium_floor (0.2); NEVER drops a never-fetched or cap-stale source (ordering-not-exclusion); fail-open; PRESETS (web_content/online_population) are dated suggestions never defaults; GET /api/scheduler/equilibrium discloses state. Maintainer-ruled: no default language bias.
2026-07-02,ingest/diagnostics,fetch_failed breakdown by reason (ff:* verdict rollup),shipped (backend verified py3.11),#539,src/ingest/fetch_verdict.py src/ingest/pipeline.py src/scheduler/runner.py src/api/diagnostics.py tests/test_fetch_verdict.py,classify_fetch_failure maps each fetch failure to a reason vocab (offline/http_403/http_404/http_5xx/timeout/dns/connect/robots/not_html/too_large/bad_url/other); flat ff:<reason> keys ride the existing int-summing tally aggregation free; performance_report gains a collection block. Closes the residual: the raw fetch_failed=13678 count can now be attributed (Tor-403 vs a real DB-lock loss) instead of guessed.
2026-07-02,sources/provenance,Content-provenance S1: newsletter channel label + self-heal,shipped (CI-verified; test skip-guarded in sandbox),#541,src/catalog/taxonomy.py src/api/ingestion.py tests/test_content_provenance.py,"""newsletter"" joins CANONICAL_SOURCE_TYPES; _ensure_import_source stamps the asserted channel on the .eml + mailbox import sources and deterministically self-heals pre-S1 rows mislabelled ""news""; asserted-by-construction (the ingest path knows the channel) never a classifier."
2026-07-02,keyword-engine,Date-extractor fabrication fixes (F4 slice A),shipped,#542 #544,src/timemap/dateextract.py tests/test_dateextract_fabrication_fixes.py,"five measured fabrication classes fixed (bare-cardinal ""of"" day, Persian tammuz incl. Solar-Hijri, sr Marta-name month-first, deictic-year regression, range-sibling fabrications) + the six defects adversarial verification found AFTER #542 merged (#544: duben-village gate, cross-month ranges, gengo year-0, sentence-boundary ranges). LESSON re-proven: the maintainer merges MID-verification -> adversarial skeptics must complete BEFORE pushing (applied to slice B)."
2026-07-02,ci/deps,nltk removed from [analysis] (PYSEC-2026-597 no fixed release),shipped,#544,pyproject.toml tests/conftest.py,pip-audit base-red fixed by REMOVING the never-imported dependency instead of --ignore-vuln; conftest _EXTRA_MODULES updated.
2026-07-02,keyword-engine,Date-extractor recall slice B (Korean + glued-CJK + 5 new month vocabularies),shipped (72 extractor tests green py3.11),#545,src/timemap/dateextract.py src/timemap/datediag.py tests/test_dateextract_recall_b.py,"Korean (year/month/day Hangul markers + deictic years + model-year suppression), digit-safe ASCII lookarounds so glued CJK prose dates match (ideographs are \w so \b never fired), hao/day-marker with classifier-noun gates (Metro Line 11 never a date), Greek accusative+accentless months, Cyrillic ordinal + Bengali clitic day attachments, hr/cs/ms/tl/sw month tables with collision gates (kolovoz=roadway, dubna/Duben, juna/jula, citation-shape Agosti/Machi/Marso); datediag probe kept in lockstep (MONTH_VOCAB_LANGS + CJK probe) so field numbers stop undercounting. TWO adversarial rounds folded in BEFORE push. Remaining: slice C (relative words/weekdays beyond en/fr/de) specced, awaiting proceed."
2026-07-02,keyword-engine,Date-extractor recall slice C (relative words + weekdays beyond en/fr/de + CJK/Korean + en offsets),shipped (94 tests green py3.11; two adversarial rounds pre-push),#548,src/timemap/dateextract.py src/timemap/datediag.py tests/test_dateextract_relative_c.py,"anchored relative-day words for ru/ar/hi/bn/el/pl/ro/nl/sv/da/sr/tr/id-ms with per-token language gates (morgen->de/nl fixes the measured da ""mandag morgen"" FP; sutra/امس/jutro gated); weekday vocabularies ×12 languages with collocation-only homographs + place-name traps + sv/da grammar (i fredags=LAST vs pa fredag=COMING); appositive guard with weekday AGREEMENT (dateline weekday never invents a second date; lists stay alive; per-span day record survives dedup); zh/ja boundary-free relatives+weekdays with calendar-week [上下本]周X + segmentation continuation set; ko relatives+weekdays with Hangul lookarounds; en ""N days ago"" + last/next/this month with duration/possessive guards; datediag probe mirrors every gate + the appositive suppression (no phantom gaps). DELIBERATE OMISSIONS in-file: ru Wednesday (в среду = into-the-environment), zh 周日, hi कल / bn কাল, ro luni, el weekdays. Two skeptic rounds reproduced 23 defect classes pre-push — all fixed + pinned (30 tests). NOTE: a git reset --soft squash nearly shipped WITHOUT the round-2 fix layer (stale index; caught by the stop hook) — after a soft-reset squash, git add -A before committing. F4 recall program (A #542/#544 · B #545 · C #548) COMPLETE."
2026-07-02,reader/keywords,Clickable in-article keywords (Slice 1),shipped (frontend browser-unverified per fork-3; core unit-verified + wiring-tested),,src/static/reader.js src/static/app.js src/static/reader.css tests/test_clickable_keywords.py,"the offline reader's Keywords-tab list is now clickable AND the article's REAL indexed keyword terms are marked inline in the Read body — each opens a new SPA tab hydrated from ?analyze=<term>&tab=keywords, landing on the Keywords subtab seeded with the term (keywords are corpora). Honesty by construction: marks ONLY the trusted corpus-keyword index (never a naive word scan); one eager loopback corpus-keywords fetch serves both the inline marking and the Keywords tab (no double request); a pure boundary-aware segmenter (word boundaries for spaced scripts so ""election"" never marks inside ""reelection""; substring for CJK/Hangul; longest-first for phrases) unit-verified in node; markArticleBody is fully guarded (a failure leaves the Read pane untouched). SPA: _anBootTab stashes the ?tab= target during boot hydration and applies it once _anSubtabs is wired (ordering fix). node --check clean, i18n 100% (reader English-by-design, no chrome strings added), 5 wiring tests + core node-verified. REMAINING: Slice 2 (a #oo-tip-style hover of REAL keyword stats — maintainer-undecided contents) + a browser click-through (fork-3)."
2026-07-02,home/latest,Article-length diagnostic (Home 'Latest in your corpus' slice S0),shipped (backend verified py3.11; endpoint CI-gated),,src/analytics/article_length.py src/api/diagnostics.py src/static/index.html tests/test_article_length.py,"the calibration blocker for the Home substance filter: GET /api/diagnostics/article-length (+download, +Settings→Diagnostics button) reports the DISTRIBUTION (n/min/max/mean/median/p10-95 + fixed-bucket histogram) of word_count AND cited-source count (outbound link_type='external' ArticleLink rows, zeros included, internal ignored) broken down PER content-type (Source.source_type) and PER language. Unsegmented languages (zh/ja/th) FLAGGED per-language so a word-gate is never blindly applied (the CJK/Thai catch). Read-only, counts only, NO score (honesty caveat says so; a key-walk test guards no score/ranking field). Pure summarizer unit-tested + the report hand-verified over an in-memory corpus; one article-row scan (occasional diagnostic, cost documented), cited-source counts from article_links (no article decrypt). Lets the maintainer pick honest per-content-type thresholds. REMAINING: S1 recency endpoint (created_at + min_words/min_sources + facets + near-dup collapse) → S2 Home panel → S3 defaults/scope/toggle."
2026-07-02,ingest/provenance,.eml sender-IP geolocation (deferred field item),shipped (backend verified py3.13 + core-only),claude/version-upgrade-plan-umv9xd,src/ingest/email.py tests/test_email_ingest.py,"sender_origin_ip() reads the sending mail-server IP from the .eml Received chain (oldest hop first, first is_global IP wins; private/reserved/doc ranges skipped; IPv6-aware; no network) and stores it on the same Article.server_ip columns web articles use, so newsletters surface on the ooMap Server-IPs layer + geolocate via the offline DB-IP lookup. Recipient-safe (sender infra, not recipient) + deduced (reason says may-be-a-relay; stripped chain stores NULL + honest reason). +3 tests. LESSON: ipaddress.is_global rejects RFC-5737/3849 documentation ranges - use real public IPs in geo tests."
2026-07-02,backup/import,Import-successful summary (imported/deduplicated totals),shipped (PR #557 merged; frontend browser-unverified per fork-3),,src/static/app.js tests/test_unified_backup_ui.py,"the unified Import dialog leads its post-restore summary with a prominent aggregate 'Import successful' banner across every restored source (corpus volumes + legacy single-file + large-data blobs + newsletters): big totals for records IMPORTED, DEDUPLICATED (already present, additively skipped) and CONFLICTS (local kept), a proportion bar, empty/errored newsletters surfaced, the additive-restore guarantee stated inline, per-source merge-plan tables kept below collapsed. Every count is a real backend number (structured tallies threaded into the summary objects); no fabricated totals. Addresses the field ask for a clear view of what was successfully imported and deduplicated."
2026-07-02,backup/restore,Legacy restore preview/commit off the event loop (stops the Previewing freeze),shipped (PR #558; backend verified py3.13 74 tests),claude/version-upgrade-plan-umv9xd,src/api/backup_v2.py src/static/app.js,"field report: a small backup stuck on 'Previewing - nothing is changed yet' for an hour. ROOT CAUSE: restore_preview/restore_commit were async def handlers doing the heavy work SYNCHRONOUSLY (decrypt+unzip, copy the WHOLE live corpus to working.db, run the FULL dry-run merge - the can't-lie guarantee makes preview ~as costly as a commit) ON the event loop, freezing the single-worker server for the whole restore (task manager wouldn't load, polls stalled, UI hung). FIX: move the blocking stage+merge into run_in_threadpool (extracted _preview_sync/_commit_sync) so the server stays responsive; honest preview message (copies+dry-run-merges the corpus, minutes on a large corpus, app stays usable in another tab). No merge logic changed. LESSON: a FastAPI async def handler runs ON the event loop (only def handlers get the threadpool) - heavy synchronous work in one freezes the whole single-worker server; thread it."
2026-07-02,markets,Show each commodity/index individually in a specific (non-general) subtab,shipped (PR #567; frontend browser-unverified per fork-3),claude/version-upgrade-plan-umv9xd,src/static/app.js tests/test_repo_invariants.py,"maintainer: commodities and indices should be shown individually in the not-general subtabs. The 'All' (general) subtab keeps the combined per-category / per-continent family overview; selecting a SPECIFIC category (Energy/Metals) or continent (Asia/Europe) now explodes that group into one graph per item via commodityFamilies/idxFamilies (single-series groups keyed by symbol). selectCommodityCat re-renders in families view (the group set changes, not a CSS hide), guarded on an actual change so the ooSubtabs init fire never recurses into renderDashboard. test_markets_specific_subtab_shows_items_individually pins it."
2026-07-02,diagnostics,Five recursive-augmentation logs (find bugs without spotting each by eye),shipped (PR #567; backend verified py3.13; frontend hook browser-unverified per fork-3),claude/version-upgrade-plan-umv9xd,src/monitoring/latency.py src/monitoring/slowquery.py src/monitoring/schema_drift.py src/monitoring/integrity.py src/monitoring/errorlog.py src/api/diagnostics.py src/api/main.py src/static/app.js src/static/index.html tests/test_recursive_logs.py,"maintainer 2026-07-02 'implement as many logs as possible for recursive AI augmentation'. Built all five, each read-only/local/network-free/counts-shape-only: #1 FRONTEND JS-error capture (errorlog.note_frontend_error + POST /api/diagnostics/frontend-error + app.js window.onerror/unhandledrejection/failed-and-5xx-fetch hook using the PRE-WRAP fetch so it can't recurse; loopback-only, no PII, throttled) turns 't is not defined'/dead clicks into a debug-bundle feed; #2 request-latency + event-loop-block (latency.py: per-route p50/p95/p99 + a loop watchdog flagging heavy sync work on the async loop = the unlock/restore/task-manager freeze family, naming in-flight requests; wired into the request middleware + lifespan); #3 slow-query + EXPLAIN (slowquery.py: passive listener over OO_SLOW_QUERY_MS, SQL shape only, + EXPLAIN QUERY PLAN of the heavy analytics = scan-vs-index; note SQLite marks index-only scans as SCAN too so only bare table scans are flagged); #4 schema/index drift (schema_drift.py: live PRAGMA vs models + migration head); #5 corpus-integrity/counter-drift (integrity.py: orphan/dangling rows, maintained counters vs live aggregate, FTS staleness, FK violations; bounded + deadline-guarded; reports drift never fixes it). All five ride /debug-bundle + /all + a GET endpoint + a Settings->Diagnostics button. 9 tests + wiring invariant; 0 new mypy errors. LESSON: a SQLite EXPLAIN QUERY PLAN 'SCAN <t> USING [COVERING] INDEX' is healthy (index-only); only a bare 'SCAN <t>' with no USING is the scaling smell."
2026-07-02,analytics,Automatic keyword cleanup (prune orphans + reconcile language) surfaced in the logs,shipped (PR #567; backend verified py3.13),claude/version-upgrade-plan-umv9xd,src/analytics/store.py src/api/insights.py src/monitoring/integrity.py tests/test_recursive_logs.py,"maintainer: 'Clean up keywords should be automatic'. store.maybe_cleanup_keywords runs the CHEAP maintenance the button's heavy re-index doesn't need - prune orphan keywords (the 69k-orphan field finding) + reconcile first-write-wins keyword language - freshness-gated to once per OO_KEYWORD_CLEANUP_HOURS (default 12h) via a data-dir marker, wired into warm_cache (off the request path, no-op most passes). Full re-index stays MANUAL/post-upgrade (too heavy unprompted). The marker records last run + tally; the corpus-integrity diagnostic surfaces it (auto_cleanup). Manual button kept (Desk lesson). On the sibling collector-write-batching ask: writer-gate contention is already automatic in diagnostics (collect_perf writer_gate.saturated) + the bandwidth governor backs off on it; the new latency/slow-query logs add visibility; the commit-batching restructure stays the deferred live-perf-gated riskiest 50-worker hot-path change (article commits durably first then keywords index best-effort - merging/cross-article batching risks the data loss the single-writer gate prevents), so surfaced not shipped blind."
2026-07-03,data-arch,Corpus-epoch mechanism (D3 double-count guard canonical source),shipped (draft PR onto 0.1; backend verified py3.13),claude/parallel-A-backend-analytics,src/database/models.py migrations/versions/e7f8a9b0c1d2_derived_meta.py src/analytics/corpus_epoch.py src/analytics/store.py tests/test_corpus_epoch.py,"The canonical source of the CORPUS EPOCH that guards the disposable columnar rollup (refresh_keyword_daily already took corpus_epoch + was tested; this builds where it comes from). New derived_meta key->value table (migration e7f8a9b0c1d2 off head d6e7f8a9b0c1; create_all builds it on fresh+existing stores, migration for the staged-upgrade path) + src/analytics/corpus_epoch.py {get_corpus_epoch, bump_corpus_epoch}. bump_corpus_epoch wired into the three non-append mutators: reindex_all_batch + reindex_articles (=the restore-merge path, since reindex_imported_articles re-indexes merged articles against the live DB after the atomic swap) + prune_orphan_keywords. Bumps once per logical mutation (guarded on non-empty work), takes the reentrant write gate, best-effort (never breaks its mutator; over-bump only forces an extra correct rebuild). Test proves the guard end-to-end: build rollup at epoch E; a re-index (delete-then-reinsert of every mention) bumps the epoch; refreshing at the STALE epoch merges incrementally and DOUBLE-COUNTS (the trap, demonstrated); refreshing at the CURRENT epoch FULL-rebuilds and restores exact counts. 0 new mypy errors; single alembic head. REMAINING (deferred, note for a later slice): wire the epoch read into warm_cache's rollup refresh + the hot-path serve behind built_epoch==corpus_epoch (the columnar serve is still dormant at runtime)."
2026-07-03,data-arch,source_coverage rollup (D4) — per-country coverage cache keyed by corpus epoch,shipped (draft PR onto 0.1; backend verified py3.13; dormant at runtime like D2/D3),claude/parallel-A-backend-analytics,src/analytics/columnar.py src/monitoring/source_coverage_benchmark.py src/api/diagnostics.py tests/test_source_coverage_rollup.py,"D4 of the derived layer: build_source_coverage/refresh_source_coverage/source_coverage_rows/source_coverage_parity in columnar.py mirror the keyword_daily (D2/D3) structure. Honest engineering: source-coverage is a TINY per-country aggregate (unlike keyword_daily's millions of per-day rows), so the win is RESULT-CACHING not columnar scan -- aggregate once with SQLite native GROUP BY (parity by construction), cache the small result in the derived store. Keyed by corpus epoch (a re-index/prune/restore forces a rebuild) AND the article/mention id watermarks (ordinary ingest picked up); FULL rebuild only (small result, no incremental to get wrong). Counts only, no score; mean tone stored as (sum,n) so a country with no scored English article reports None (never a fabricated zero); country-less -> '' unlocated bucket, never guessed onto a map. src/monitoring/source_coverage_benchmark.py + GET /api/diagnostics/source-coverage-benchmark: builds in-memory over the real corpus, times live-vs-rollup reads + the speedup, a parity check (counts must match exactly), and the rollup wrapped in the honesty envelope {value,basis:estimated,as_of,method,n}. Read-only/in-memory/airplane-safe. 5 tests (parity vs source_country_counts, honest mean-tone, unlocated bucket, epoch/watermark refresh decision, benchmark shape); 0 new mypy errors; bandit clean. DORMANT AT RUNTIME like D2/D3 (offline the store is in-memory = per-process rebuild; the durability win lands with the persisted D1 store, blocked on httpfs bundling). REMAINING: wire into the live map endpoint once D1 lands."
2026-07-03,stats,Benjamini-Hochberg FDR module (the multiple-testing spine),shipped (draft PR onto 0.1; backend verified py3.13),claude/parallel-A-backend-analytics,src/stats/fdr.py tests/test_fdr.py,"Pure, textbook BH (1995) false-discovery-rate control -- the shared multiple-testing correction any SCREENING analytic (lunar correlation, flood/bury, manipulation scans) runs before surfacing a result, so a screen of m tests can honestly report 'these survived correction' instead of the ~alpha*m false positives a bare significant p-value produces. benjamini_hochberg(pvalues,q,dependency) -> FdrResult{q,m,rejected(original indices),n_rejected,threshold(BH cutoff or None),adjusted(q-values in input order),dependency,method}; bh_adjusted() = the step-up q-values. No dependency, no I/O, no state. Standard BH (independent/positive dependence) + the conservative BH-Yekutieli variant for arbitrary dependence. A DISCLOSURE (which survive at level q + by how much), never a score. Validated two ways: hand-computed cutoffs on textbook datasets (the m=8 case rejects {0,1} at thr 0.011; the classic 15-hypothesis dataset rejects 1..4) AND cross-checked against scipy.stats.false_discovery_control over 20 random cases (scipy is a dev/test dep only, never a runtime dependency). 9 tests; 0 new mypy errors; ruff clean."
