date,area,item,status,refs,key_paths,summary
2026-06-23,security/custody,2026-06-23 P0 §3.1 — INGEST-UNDER-PARALLEL-LOAD WRITER-GATE REGRESSION TEST,shipped,#447 #384 claude/nice-davinci-bqufft,src/database/write.py,the 2026-06-22 audit confirmed the single-writer gate (keystone #1) covers every write path and the 149 `database is locked` errors predate the do_orm_execute fix (#384) — but the corpus runs up to ~50 PARALLEL collect workers against one e
2026-06-23,keyword-engine,2026-06-23 KEYWORD REDUCTION §2.5 — DIGIT-HEAVY CODE-TOKEN EXTRACTION FILTER,partial,claude/nice-davinci-bqufft,src/analytics/extract.py tests/test_keyword_code_tokens.py,"the 2026-06-23 live log (27,303 articles / 406,723 keywords) showed a ~35k bucket of alphanumeric CODE tokens (A-10C, internal ids, model-variant cruft, clock timecodes 1h15) minted as junk keywords — ""NOT yet filtered at extraction."" HONES"
2026-06-23,ui/chrome,HOME-CARD FLIP REDESIGN,partial,#445 #23 claude/trusting-maxwell-p7y2g8,,"the briefing Lead card is now a two-sided 3D FLIP card. FRONT = the lead at a glance (family-themed chip + title + summary[line-clamped] + signal + a ""Details & corpus ⟲"" hint); BACK = caveat + Method + ""Why am I seeing this?"" plain + the e"
2026-06-22,map/geo,GOVERNMENTS TAB — rename World Law + per-country data + map,partial,#14 claude/trusting-maxwell-p7y2g8,src/stats/fetch.fetch_worldbank src/stats/indicators.py src/api/governments.py tests/test_governments_api.py src/catalog/countries.py,"built on the EXISTING substrate — `StatFigure` (per-country/indicator/year vintaged store) + `src/stats/fetch.fetch_worldbank(code,""all"")` + `ooMap` (choropleth) + `ooSubtabs`. PLAN: Governments tab with subtabs **Countries · Map · Law** (L"
2026-06-22,keyword-engine,2026-06-22 FIELD-TEST REMAINDER — WORLD LAW AUTO-SCRAPE WIRING,partial,#18 claude/trusting-maxwell-p7y2g8,docs/baselines src/law/track.py docs/pass configs/legal.yml tests/test_law.py,"the World-law tab was empty (law_track 0 docs/baselines) because legal documents are tracked ONLY in `mode==""law""`, never in the default rss collect pass — the SAME gap markets had before its per-pass auto-load. `src/law/track.py: auto_trac"
2026-06-22,keyword-engine,2026-06-22 FIELD-TEST REMAINDER — CUSTODY DISSOLVED FROM THE SIDEBAR,partial,#20 #22 claude/trusting-maxwell-p7y2g8,,"""Evidence & custody"" is an ACTION on content, so it leaves the (now flat) sidebar — completing the Trust-group dissolution started by #22 — and moves to Settings → Safety (a `showTab('custody')` button, mirroring the earlier integrity disso"
2026-06-22,ui/chrome,2026-06-22 FIELD-TEST REMAINDER — FLAT SIDEBAR + REMOVE SIDEBAR-VISIBILITY,shipped,#22 #17 #20 #23 claude/trusting-maxwell-p7y2g8,,"the sidebar section headers (Investigate/Collect/Trust .gl labels + .nav-group wrappers) are GONE — one FLAT list (`nav.nav-groups.flat`), same order, all tabs present + reachable (invariant #2 intact; also via the command palette). The out"
2026-06-22,misc,2026-06-22 FIELD-TEST REMAINDER — SOURCES MULTI-SELECT FILTERS,partial,#23 #19 claude/trusting-maxwell-p7y2g8,tests/test_source_facets_filters.py,Settings → Sources filters converted from single text inputs to multi-select DROPDOWNS fed by a cheap facets endpoint. Backend: NEW `GET /api/sources/facets` (distinct languages/countries/types/tags + real counts via ONE column-projected qu
2026-06-22,collector/scheduler,2026-06-22 FIELD-TEST REMAINDER — TASK-MANAGER SHOWS THE ACTUAL STRATA,shipped,claude/trusting-maxwell-p7y2g8,tests/test_collection_activity.py,"the Queue preview claimed ""stratified by language and tag"" but never SHOWED the strata. `plan_preview` now emits `strata` = {languages:[{key,n}], tags:[{key,n}], sampled, note} derived from the bounded `rows` sample it ALREADY fetches (ZERO"
2026-06-22,agenda/events,2026-06-22 FIELD-TEST REMAINDER — DEAD CALENDAR FEEDS EXCLUDED FROM AUTO-IMPORT,partial,claude/trusting-maxwell-p7y2g8,configs/calendar_feeds.yml tests/test_calendar_autoimport.py,"the per-pass `auto_import_due_feeds` round-robin included the ~238 robots-disallowed `google-hol-*` (calendar.google.com) + 16 `webcal.guru` feeds, and because ""google-hol-*"" sorts BEFORE the working ""wph-*"" ids, the round-robin attempted ~"
2026-06-22,security/custody,2026-06-22 FIELD-TEST REMAINDER — BOOT-COLD CACHE WARM,partial,claude/trusting-maxwell-p7y2g8,tests/headless src/api/insights.py,"the in-memory insights read cache is empty after a restart, so the FIRST Home/Insights open paid the cold whole-corpus aggregation (warm_cache runs after a scrape pass, but boot is AIRPLANE mode -> no pass; a user who boots + stays offline "
2026-06-22,keyword-engine,2026-06-22 FIELD-TEST REMAINDER — KEYWORD-ENGINE & DATE-VOCAB BATCH,partial,claude/trusting-maxwell-p7y2g8,tests/test_dateextract_more_languages.py,"Two slices: (1) **NO_STOPLIST TAIL → MANAGED.** Promoted 14 languages to `MANAGED_LANGUAGES` after verifying each tokenises WHOLE words (empirical 2026-06-22) + giving each a pure-grammar stoplist: fa/ur (Arabic script), uk (Cyrillic, the g"
2026-06-22,backup/restore,2026-06-22 SESSION — POST-MERGE CONTINUATION,partial,#439 #10 #441 #11 #12,src/api/files.py tests/test_fs_browser.py,the folder-backup destination + the .eml folder-import took a server-side path the user had to TYPE (a browser file dialog can't return a host path). NEW `src/api/files.py` `GET /api/fs/list?path=&show_hidden=` lists a directory's SUBDIRECT
2026-06-22,perf/scaling,2026-06-22 AUTONOMOUS SESSION,partial,#384 claude/keen-davinci-jvsmfh,docs/design/AUTONOMOUS_SESSION_BRIEF_2026-06-22.md tests/test_ingest_index_retry.py tests/test_errorlog_summary.py tests/test_merge_dates_collision.py tests/test_briefing_stale_cache.py tests/test_insights_cache.py,SHIPPED anyway as warranted defence-in-depth + the trustworthiness fix that lets the maintainer SEE it's closed: - **P0-1 defence-in-depth (data-loss class):** `index_article`'s when/where/who block RE-RAISES a lock error instead of swallow
2026-06-21,keyword-engine,KEYWORD-COUNT REDUCTION + RING-LOOP,shipped,claude/magical-brown-49m9nd,tests/test_keyword_counters.py docs/testing/LEGAL_DECLINE_UNINSTALL_TEST.md,"the honest read recorded — ~500K keywords is mostly JUNK (markup tokens + unmanaged-language function words + merge-orphans), NOT legitimate rare terms, so the reduction is junk-REMOVAL (aligned with the no-arbitrary-cap policy), not a cap."
2026-06-21,misc,INSTALL NETWORK-RESILIENCE,shipped,claude/magical-brown-49m9nd,tests/test_installer.py,"ROOT CAUSE was a NETWORK/DNS dropout mid-resolution (`Temporary failure in name resolution` / `Read timed out` for files.pythonhosted.org), not a real dependency conflict — pip's default 15s timeout made it backtrack through every nltk/netw"
2026-06-21,map/geo,FIELD-TEST REMAINDER BATCH 5,partial,#420 claude/magical-brown-49m9nd,tests/test_keyword_counters.py,"SHIPPED, each its own slice: (§2.3) OFFLINE-MAP per-row reorder — queued OSM region downloads now show their queue position (#N) + ↑/↓ controls in the Settings list (`osmMove`, optimistic renumber+repaint then `/api/geo/downloads/reorder`);"
2026-06-21,llm/ai,FIRST-LAUNCH LEGAL-ACCEPTANCE GATE + LEGAL DOCS ×12 UI LANGUAGES,partial,#425 #426 #428 #429 #430 claude/quirky-goodall-86u3ex,src/safety/uninstall.request_uninstall src/legal/documents.py docs/legal/ src/api/legal.py tests/test_legal_documents.py,"THREE maintainer rulings (AskUserQuestion): (a) DECLINE = confirm-then-UNINSTALL (typed `UNINSTALL`, reuses `src/safety/uninstall.request_uninstall` SECURE mode — venv/launchers/app-folder removed + data&keys wiped); (b) translations AI-DRA"
2026-06-21,stats/official-statistics,FIELD-TEST FOLLOW-UP BATCH 3,partial,#427 #21 claude/amazing-tesla-z6bwkm,,"per-item shipped notes live in their own ledger entries; this is the roll-up. SHIPPED: §2.B FOLDER-IMPORT JOB (pausable DB-writer, reuses batched ingest_emails — entry above) · §2.C MODEL-DOWNLOAD QUEUE + AI-tab downloads section (entry abo"
2026-06-21,stats/official-statistics,FIELD-TEST FOLLOW-UP BATCH 4,partial,#427 claude/amazing-tesla-z6bwkm,,"SHIPPED (each its own entry above, this is the roll-up): (a) the §2.B PERSISTED IMPORT CURSOR (resume survives an app restart — entry above; backend VERIFIED py3.11); (b) a determinate `<progress>` bar on the .eml folder-import UI (driven b"
,keyword-engine,TRENDING COVERING INDEX,partial,claude/amazing-tesla-z6bwkm,tests/test_trending_index.py,"`/api/insights/trending-windows` (~20s idle / ~98s under load, polled from Home) is observed_on-WINDOWED, so the corpus-wide keyword counters can't serve it; `trending()._counts` runs `SELECT keyword_id, SUM(count) WHERE observed_on IN [lo,"
2026-06-20,keyword-engine,MARKUP STRIP AT THE EXTRACTION CHOKEPOINT,partial,claude/amazing-tesla-z6bwkm,src/analytics/extract.py tests/test_keyword_extract_strips_markup.py,"the keyword tokenizer `_WORD_RE` mints `div`/`span`/`max-width`/`font-size`/`font-family` directly from any raw HTML/CSS in a stored body (CSS property names with hyphens tokenise as ONE word) — the live log's 36,519-keyword unknown-languag"
2026-06-20,keyword-engine,IN-APP SCALING BENCHMARK 2026-06-20,shipped,#419 claude/modest-hopper-gisgst,src/monitoring/benchmark.py tests/test_benchmark.py,"the data-architecture scaling work was proven byte-identical but never proven FAST at scale on a real machine. `src/monitoring/benchmark.py`: `run_benchmark(session, repeats=3)` times the hot read paths against the LIVE corpus N times (run "
2026-06-20,backup/restore,BACKUP IMPORT ACROSS VERSIONS — CONFIRMED TO MAINTAINER 2026-06-20,shipped,,,"maintainer asked whether OLD-architecture backups are usable + whether articles get re-analysed on import. ANSWER = YES to both: oo-backup-2 artifacts restore additively (merge engine) down to the 0.0.8-baseline schema floor (FLOOR_NOTE ""0."
2026-06-20,stats/official-statistics,AUTONOMOUS V0.1 BATCH,partial,#413 #51 #23 claude/sweet-keller-ozdip1,tests/test_repo_invariants.py,"**AUTONOMOUS V0.1 BATCH (2026-06-20, branch claude/sweet-keller-ozdip1 = ONE rolling branch per the system-reminder ""develop only on this branch / NEVER push to a different branch""; PR #413 draft onto 0.09, accumulating commits — also elimi"
2026-06-20,stats/official-statistics,AUTONOMOUS V0.1 — THEME-2 #51 OSM ADMIN-BOUNDARY CHOROPLETH,partial,#51 claude/sweet-keller-ozdip1,src/static/osmpbf.js tests/osmpbf_node_test.js tests/test_repo_invariants.py,"the maintainer-ruled #51 — colour each country by data using REAL OSM admin boundaries, fixing the ~75 microstates the coarse Natural-Earth 110m `world_countries.json` drops. Built on the shipped `src/static/osmpbf.js` (it decoded dense nod"
2026-06-19,keyword-engine,"SLICE 4 PR-3 — HEAVY-AGGREGATION PERF VIA THE COUNTERS, NOT DUCKDB 2026-06-19",partial,,tests/test_associations_perf.py,"the honest engineering call — /api/insights/associations (76 s) was an N+1, not a columnar problem, so the Slice-2 counters fix it with no new dependency, no persistence gate, offline, byte-identical. queries.associations now batch-loads th"
2026-06-19,data-arch/diagnostics,EXTERNAL-ARTIFACT FRESHNESS REGISTRY + COMPATIBILITY TESTS 2026-06-19,partial,,configs/external_artifacts.yml src/maintenance/registry.py tests/test_external_freshness.py scripts/check_external_freshness.py docs/maintenance/EXTERNAL_DEPENDENCIES.md,"the project had ~8 dated `*_AS_OF` constants + vendored data + version couplings guarded by SCATTERED per-file freshness tests, with no single list + no upstream watch. Consolidated into: (1) `configs/external_artifacts.yml` = the SINGLE SO"
2026-06-19,data-arch/diagnostics,DATA-ARCHITECTURE FOLLOW-UP 2026-06-19,shipped,#410 #407,src/geo/data/dbip_country_lite.csv.gz,"**A — real IP-geo DB BUNDLED (Slice 6b complete):** db-ip.com 403s, but the DB-IP CC BY 4.0 MIRROR (sapics/ip-location-db, identical start,end,CC) is reachable → bundled the real country table `src/geo/data/dbip_country_lite.csv.gz` (~4.4 M"
2026-06-19,perf/scaling,DATA-ARCHITECTURE & SOURCE-IP BUILD 2026-06-19,partial,claude/modest-hopper-gisgst,src/analytics/envelope.py tests/test_envelope.py src/analytics/readmodel.py tests/test_readmodel_seam.py src/analytics/ tests/test_columnar_engine.py tests/test_article_identity_seams.py tests/test_source_ip_capture.py,"**Slice 1 — honesty envelope** `src/analytics/envelope.py` (Envelope{value,basis,as_of,method,n}; exact/estimated; as_of REQUIRED never fabricated; assert_no_score_fields run on it at import). tests/test_envelope.py. - **Slice 2 — counter f"
2026-06-19,backup/restore,FIELD TEST 2026-06-19 — THEME-3 ANALYSIS-WINDOW-PER-QUERY,partial,claude/gallant-bohr-1cogzj,,"the singleton #an analysis window became a MULTI-DOCUMENT WORKSPACE. A search / Lead / keyword now SPAWNS a NAMED, closeable, persisted TAB (`#an-tabstrip`) over the one render area; several searches coexist as parallel tabs (deduped by see"
2026-06-19,map/geo,FIELD TEST 2026-06-19 — LARGE-UI-REWRITE BATCH,partial,claude/gallant-bohr-1cogzj,,"batch-1 rulings (AskUserQuestion 2026-06-19): (1) THEME-3 = RETIRE BOTH the empty singleton #an AND the legacy #corpus-win modal → ONE analysis surface (analysis-window-per-query, named/closeable/ persisted spawned tabs + an Overview screen"
2026-06-19,ui/chrome,FIELD TEST 2026-06-19 — THEME-5 i18n: DE-TAGGING PHASE SLICE 2,shipped,#405 #399 claude/gallant-bohr-1cogzj,,"continued the de-tagging burn-down on the INSIGHTS-tab help texts — de-tagged 4 `<p class=""hint"">` paragraphs (dropped inline `<b>`/`<em>`, EXAMPLE/proper-noun tokens kept literal inside the sentence) + keyed them ×12: the LINKS citation-gr"
2026-06-19,keyword-engine,FIELD TEST 2026-06-19 — THEME-5 i18n: DE-TAGGING PHASE SLICE 1 ×12,partial,#404 claude/gallant-bohr-1cogzj,,STARTED the harder inline-tag de-tagging phase (the single-node tail being exhausted). De-tagged 3 help paragraphs in index.html (dropped the cosmetic inline `<strong>`/`<em>` so each `<p>` is ONE text node — the established ledger conventi
2026-06-19,keyword-engine,FIELD TEST 2026-06-19 — THEME-5 i18n: CLEAN CAPTIONS + LABELS SLICE ×12,partial,#403 claude/gallant-bohr-1cogzj,,"the easy-LABEL tail being nearly exhausted, this slice keyed the remaining CLEAN, SINGLE-NODE strings that need NO inline-tag de-tagging — 6 labels (Trends · User Manual · Value column · Value regex · View chain · Unit) + 5 complete honesty"
2026-06-19,stats/official-statistics,FIELD TEST 2026-06-19 — THEME-5 i18n: STATIC-LABEL BURN-DOWN SLICE ×12,partial,#402 claude/gallant-bohr-1cogzj,,"continued the documented panel tail — keyed 31 CLEAN, short, single-text-node chrome LABELS scattered across the Insights/Settings/Search/Sources panels (Add a source · Add rule · Add a custom extractor · Add a price-extraction rule · Advan"
2026-06-19,keyword-engine,FIELD TEST 2026-06-19 — THEME-5 i18n: THIS-SESSION'S UI STRINGS ×12,partial,#400 claude/gallant-bohr-1cogzj,,"keyed the 33 NEW visible strings the merged session added through `t()` with English fallback — so the session's OWN additions leave NO English-fallback debt. Covers P2-10 (the families member-chip + price-detail + Correlate labels), the TH"
2026-06-19,stats/official-statistics,FIELD TEST 2026-06-19 — THEME-2 IN-BROWSER OSM .pbf RENDERER,partial,#51 claude/gallant-bohr-1cogzj,src/static/osmpbf.js tests/osmpbf_node_test.js tests/test_osmpbf_parser.py,"the maintainer's chosen path to render a DOWNLOADED offline-map region with NO network + no heavy WebGL. NEW `src/static/osmpbf.js` = a dependency-free OSM PBF reader: protobuf varint/zigzag primitives, the BlobHeader/Blob container, zlib v"
2026-06-19,stats/official-statistics,FIELD TEST 2026-06-19 — THEME-5 i18n: SECURITY SENTENCES ×12,partial,#64 claude/gallant-bohr-1cogzj,,"the explicitly-named, security-CRITICAL subset of the THEME-5 tail — the airplane STATE titles (#5: ""Online — click to go offline (airplane mode)…"" / ""Offline (airplane mode) — click to go online; you'll be asked to confirm first."") and the"
2026-06-19,stats/official-statistics,FIELD TEST 2026-06-19 — THEME-5 i18n: STATUS-BAR + SESSION-NEW STRINGS ×12,partial,#59 #42 #64 claude/gallant-bohr-1cogzj,,"the always-on status pill showed hardcoded lowercase ""healthy""/ ""offline""/""checking…"" (the #59 named gap) — routed through `t()` and keyed ×12, plus this session's short new visible strings (""AI"" subtab #42, ""encrypted (AES-256-GCM)"" / ""pla"
2026-06-19,keyword-engine,FIELD TEST 2026-06-19 — P2-8 TRENDS AS CLICKABLE BAR GRAPHS,shipped,#25 claude/gallant-bohr-1cogzj,,"the Insights → Trends rising/top LISTS became clickable horizontal BAR graphs (`termBarsHtml`): keywords top→down, bar length ∝ the REAL measured value (rising = growth rate, top = mention count — normalised to the max, NEVER a composite sc"
2026-06-19,map/geo,FIELD TEST 2026-06-19 — THEME-2 WORLD MAP,partial,#14 #15 #51 claude/gallant-bohr-1cogzj,,"the unified ooMap (the world map after the 5b retire) got three contained, honesty-relevant fixes. (#14 near-time) the ""near in space & time"" co-occurrence used the SLIDER's focus window (~span/12 ≈ 166y on an antiquity→now span) so it link"
2026-06-19,misc,"FIELD TEST 2026-06-19 — P2-2 CARD DECLUTTER VIA A ""?"" AFFORDANCE",partial,#19 #66 #23 claude/gallant-bohr-1cogzj,,"the maintainer found Leads cluttered with the verbose ""why""/method. Consolidated the ""Why am I seeing this?"" (plain sentence + exact math) AND the Method into ONE per-card ""?"" affordance (`.card-info` `<details>`) at the BOTTOM-RIGHT of `.a"
2026-06-19,stats/official-statistics,FIELD TEST 2026-06-19 — P2-5/THEME-1 BROWSER-STYLE SUBTABS + P2-11 MODELS→AI,shipped,#31 #57 #42 claude/gallant-bohr-1cogzj,,"the maintainer found the subtab active-state ""unreliable"" and wants ONE homogeneous browser-tab look. Restyled `nav.tabs` (the universal ooSubtabs component, used by Insights/Settings/markets/ Home-families/task-manager/analysis) into a bas"
2026-06-19,stats/official-statistics,FIELD TEST 2026-06-19 — THEME-4 FULL LANGUAGE NAMES,partial,#52 #53 #16 claude/gallant-bohr-1cogzj,,"the maintainer wants the full language WORD everywhere a 2-letter code shows (except the top status-bar flag). Added `ooLangName(code)` — the language analog of `ooRegionName`, using the browser's own CLDR via `Intl.DisplayNames(type:""langu"
2026-06-19,stats/official-statistics,"FIELD TEST 2026-06-19 — P2-1 REMOVED THE ""CONTROVERSIAL"" SOURCE VERDICT",shipped,#50 #396 claude/gallant-bohr-1cogzj,,"maintainer — ""users should make their humble opinions."" Calling a source ""controversial"" is itself a VERDICT, so removing it INCREASES honesty (evidence-trails-not- verdicts). Dropped the per-source verdict everywhere: `agencies.py` to_dict"
2026-06-19,stats/official-statistics,FIELD TEST 2026-06-19 — P3 NETWORK/SAFETY POLISH,shipped,#64 claude/gallant-bohr-1cogzj,,"(#O-5) the go-online TRANSITION now flashes GREEN (`--ok`, the ""go"" signal) and go-offline a calm/grounded neutral (`--muted`) — the two were swapped (go-OFF was green, go-ON the accent). (#5) the airplane button's hover title is now STATE-"
2026-06-19,stats/official-statistics,FIELD TEST 2026-06-19 — P1 MARKETS SUBTAB ACTIVE-STATE,shipped,#31 #18 claude/gallant-bohr-1cogzj,,"the Markets category subtab kept ""All"" visually active after switching to another category (content filtered correctly, only the HIGHLIGHT was wrong). ROOT CAUSE: the universal `ooSubtabs` (invariant #18) captured its button array ONCE, but"
2026-06-19,keyword-engine,FIELD TEST 2026-06-19 — P1 LIVE LANGUAGE SWITCH RE-RENDERS CLDR NAMES,shipped,#16 claude/gallant-bohr-1cogzj,,"country/continent names updated only on a full page refresh. ROOT CAUSE: `ooRegionName`/ `Intl.DisplayNames` localize names at RENDER time, but the i18n DOM walker (`apply()`) translates by EXACT-English-string match — it cannot re-derive a"
2026-06-19,map/geo,FIELD TEST 2026-06-19 — P1 DOWNLOADS HONOUR AIRPLANE,partial,#36 #41 claude/gallant-bohr-1cogzj,src/wiki/dumps.py src/geo/osm_downloads.py,"two honesty bugs in the wiki-dump + OSM download managers. (1) The chunk loop checked ONLY the per-download Pause event, NOT the kill switch — a download started before airplane kept reading from its open socket after the toggle. FIX: `(sto"
2026-06-19,backup/restore,FIELD TEST 2026-06-19 — P0-4 IMPORT RECOMPUTES CORE-ENGINE METADATA,partial,claude/gallant-bohr-1cogzj,tests/test_reindex_on_import.py,"maintainer ruling on restore semantics — AI artifacts (translations/summaries/ai_keyword) kept AS-IS, but CORE-ENGINE derived data (keywords, date/place/entity extraction, sentiment) RECOMPUTED on import so an OLD backup aligns with the imp"
2026-06-19,backup/restore,FIELD TEST 2026-06-19 — P0-3 RESTORE PREVIEW ALWAYS ANSWERS JSON,partial,claude/gallant-bohr-1cogzj,tests/test_restore_preview_robust_errors.py,"two older-version backups failed to preview with ""JSON.parse: unexpected character at line 1 column 1"" — the SPA calls res.json() on every response, and an exception escaping `run_restore` (e.g. an old corpus's staged-migration failure) RE-"
2026-06-19,backup/restore,FIELD TEST 2026-06-19 — P0-2 BACKUP ENCRYPTION IS PROVABLY REAL,shipped,claude/gallant-bohr-1cogzj,tests/test_backup_encryption_real.py,"the maintainer saw an encrypted + a plaintext backup report the SAME size and asked ""is it actually encrypted?"". ROOT CAUSE = display rounding, NOT a broken cipher: `encrypt_bytes` is genuine AES-256-GCM + scrypt (OOENC1 header 48B + GCM ta"
2026-06-18,keyword-engine,"PERF — DENORMALISED KEYWORD COUNTERS, SLICE 1",shipped,#392 claude/nice-sagan-tompbw claude/nice-sagan-tompbw-s2,tests/test_keyword_counters.py tests/test_keyword_counter_queries.py,"`Keyword.mention_count` (SUM of per-article occurrence counts) + `Keyword.article_count` (DISTINCT articles) + `idx_keyword_mention_count`, maintained AT INDEX TIME so the hot whole-corpus aggregations can later read an indexed counter inst"
2026-06-18,perf/scaling,PERF — CACHE THE PER-QUERY ANALYSIS ENDPOINTS,partial,#372 claude/perf-graph-assoc-cache,tests/test_insights_cache.py,"/api/insights/associations (76s) + /graph (103s) are whole-corpus co-occurrence/PMI (genuinely heavy, not a simple pathology), explored ON-DEMAND by term. Extended the #372 TTL cache (`_cached`/`_ckey`, computed_at+cache_ttl_s+cached flag) "
2026-06-18,llm/ai,PERF — FRAMING 141s,partial,claude/perf-framing,tests/test_framing_perf.py,"/api/framing was the slowest endpoint — it ran VADER over the FULL text of up to 1000 articles AND concatenated all of each source's content for term-frequency, and the corpus includes long Wikipedia pages, so the pure-Python VADER + concat"
2026-06-18,keyword-engine,DIAGNOSTICS — STOPWORD-CANDIDATE DIGEST,partial,#366 claude/diag-stopword-candidates,tests/test_stopword_candidates.py,"the recursive-improvement loop is ""grow the not-a-keyword (stopword) list"", and the keyword log was a 24 MB dump of the top-5000/language keywords — the wrong shape. INSIGHT: a function word is SHORT, FREQUENT and UBIQUITOUS (spread across "
2026-06-18,stats/official-statistics,PERF — IDLE BROWSER-CPU 40%,partial,#14 claude/perf-idle-cpu,,"ROOT CAUSE — `#net-toggle.off` ran `animation: netpulse 2.2s infinite` animating a BOX-SHADOW forever. Airplane mode is the idle/default state, so the button pulsed at rest, and an animated box-shadow forces a full repaint every frame (a kn"
2026-06-18,perf/scaling,PERF — INSIGHTS READ CACHE + BACKGROUND WARM,partial,claude/perf-insights-cache,src/api/insights.py tests/test_insights_cache.py,"the whole-corpus read endpoints (top 2.7s, trending, trending-windows 8-36s POLLED 132x from Home, map-coverage 7-9s) GROUP BY over the full 829k-mention table EVERY call and recompute identical numbers. Added a short TTL cache (src/api/ins"
2026-06-18,stats/official-statistics,STATS DISPLAY CLEANUP + DATA-MODEL ASSESSMENT,shipped,#366 claude/stats-cleanup,src/discovery/channels.py,"removed three counters from the Database/Home stats (database._COUNTED_TABLES + the frontend HOME_STAT_LABELS, both render dynamically): `article_analyses` (""pointless"" — LLM summaries/translations are an internal artifact, not a corpus met"
2026-06-18,backup/restore,"BACKUP FIX — stage on disk, not tmpfs",partial,claude/fix-backup-tmpfs,tests/test_backup_staging.py,"ROOT CAUSE — backup_v2 created its temp file via `tempfile.mkstemp()` (default /tmp) and `write_backup_v2` builds in `dest.parent`, so the WHOLE build (a ~460 MB corpus snapshot + the ~460 MB zip + the final artifact) landed in /tmp, which "
2026-06-18,collector/scheduler,SOURCE-LANGUAGE GATING — unmanaged languages disabled by default,partial,claude/source-language-gating,src/analytics/managed.py tests/test_managed_languages.py,ONE source of truth `src/analytics/managed.py` (MANAGED_LANGUAGES = the 18 functional-stoplist langs en/fr/de/ es/it/pt/nl/ru/ar/hu/id/sv/da/nb/no/pl/sr/sl; UNSEGMENTED zh/ja; is_managed/is_unmanaged/language_status/ normalize_lang — engine
2026-06-18,keyword-engine,PERF — SUPERGROUPS 132s→fast,partial,,tests/test_supergroups.py,"the maintainer clicked Insights → Groups on a 10,252-article / 244,866-keyword / 829,226-mention corpus (408 MB encrypted, 2 cores, 5.6 GB RAM); /api/insights/supergroups took 132 s and FROZE the UI (clicks queued, airplane toggle unrespons"
2026-06-18,stats/official-statistics,TASK-MANAGER REDESIGN — WINDOWS-STYLE,partial,claude/taskmgr-windows-redesign,src/static/taskmanager.html src/monitoring/tasks.py,"the standalone /tasks page (src/static/taskmanager.html) rebuilt into a Windows-Task-Manager-style window: a PERSISTENT resource SUMMARY strip (state chip — Online·collecting / Airplane mode [red] / Idle, honest from activity.online — + liv"
